name,url,city,title,description,duration,location
1. Gran Malecón,https://www.tripadvisor.co/Attraction_Review-g297473-d12785540-Reviews-Gran_Malecon-Barranquilla_Atlantico_Department.html,Atlantico,Gran Malecón,Malecón ubicado sobre ribera del río Magdalena con hermosos paisajes del río y el Vía Parque Isla Salamanca. Es el espacio ideal para las familias que buscan disfrutar de una experiencia al aire libre y en contacto directo con las riquezas naturales del entorno. Incluye corredor verde parque para niños ciclo rutas y una variada oferta gastronómica.,Más de 3 horas,Avenida Gran Malecón Barranquilla 080001 Colombia
2. Centro Comercial Buenavista,https://www.tripadvisor.co/Attraction_Review-g297473-d6952309-Reviews-Centro_Comercial_Buenavista-Barranquilla_Atlantico_Department.html,Atlantico,Centro Comercial Buenavista,Centro Comercial Buenavista Barranquilla para disfrutar de las mejores marcas restaurantes diversión y entretenimiento de la ciudad de Barranquilla. El Caribe hoy tiene una nueva experiencia en compras y diversión gracias a la marca BUENAVISTA la más exclusiva red de centros comerciales con presencia en Barranquilla Santa Marta y Montería.,Sugiere ediciones para mejorar lo que mostramos.Mejorar este perfil,
3. Zoológico De Barranquilla,https://www.tripadvisor.co/Attraction_Review-g297473-d2390415-Reviews-Zoologico_de_Barranquilla-Barranquilla_Atlantico_Department.html,Atlantico,Zoológico De Barranquilla,Único zoológico en la región Caribe colombiana promovemos la cultura de la conservación a través del cuidado a más de 600 animales de Colombia y el mundo.,2-3 horas,Calle 77 68-40 Barranquilla 080014 Colombia
4. Catedral Metropolitana María Reina de Barranquilla,https://www.tripadvisor.co/Attraction_Review-g297473-d3223708-Reviews-Catedral_Metropolitana_Maria_Reina_de_Barranquilla-Barranquilla_Atlantico_Departm.html,Atlantico,Catedral Metropolitana María Reina de Barranquilla,Es la iglesia más representativa de Barranquilla uno de los estandartes de la Fé cristiana. La obra maestra consta de varios elementos extraodinarios que se consideran de gran atractivo por si solos: la gran obra escultural del maestro Rodrigo Arenas Betancourt un momumento de 16 tonelas en homenaje a Cristo Liberador Latinoamericano; los dos grandes mosaicos a San José Patrono de la Arquidiócesis de Barranquilla y a María Reina titular de la Catedral metropolitana; los gigantescos vitrales fiel representación de la creación y los sacramentos de la iglesia cátolica y el altar principal recubierto en la parte posterior con la representación del universo liberado por cristo: el hombre la naturaleza los astros y la palabra de Dios.,Sugiere ediciones para mejorar lo que mostramos.Mejorar este perfil,
5. Viva Centro Comercial,https://www.tripadvisor.co/Attraction_Review-g297473-d8599579-Reviews-Viva_Centro_Comercial-Barranquilla_Atlantico_Department.html,Atlantico,Viva Centro Comercial,,,Coronado Ferry Landing Barranquilla 080020 Colombia
6. Monumento Ventana Al Mundo,https://www.tripadvisor.co/Attraction_Review-g297473-d15606617-Reviews-Monumento_Ventana_Al_Mundo-Barranquilla_Atlantico_Department.html,Atlantico,Monumento Ventana Al Mundo,,,
7. Carnaval de Barranquilla,https://www.tripadvisor.co/Attraction_Review-g297473-d6351019-Reviews-Carnaval_de_Barranquilla-Barranquilla_Atlantico_Department.html,Atlantico,Carnaval de Barranquilla,Evite Río el mejor carnaval está en Barranquilla. Comenzando el sábado previo al Miércoles de Ceniza el Carnaval de Barranquilla es una de las celebraciones más grandes de Colombia y uno de los carnavales (festival religioso) más grandes del mundo. Presentando música en vivo montones de bailes y un desfile inmenso lleno de parranderos disfrazados; el Carnaval de Barranquilla paraliza la ciudad por cuatro días inolvidables. Las festividades comienzan con La Batalla de las Flores un desfile de carrozas complejas y continua con más días de baile disfraces y celebraciones.,Más de 3 horas,
8. Hotel El Prado,https://www.tripadvisor.co/Attraction_Review-g297473-d8670362-Reviews-Hotel_El_Prado-Barranquilla_Atlantico_Department.html,Atlantico,Hotel El Prado,,,Carrera 54 70 10 Barranquilla 080002 Colombia
9. Castillo de Salgar,https://www.tripadvisor.co/Attraction_Review-g4454796-d3239343-Reviews-Castillo_de_Salgar-Puerto_Colombia_Atlantico_Department.html,Atlantico,Castillo de Salgar,,2-3 horas,
10. Bocas de Cenizas,https://www.tripadvisor.co/Attraction_Review-g297473-d3624580-Reviews-Bocas_de_Cenizas-Barranquilla_Atlantico_Department.html,Atlantico,Bocas de Cenizas,,,Desirée Geeraertstraat Barranquilla 080001 Colombia
11. Museo Mapuka,https://www.tripadvisor.co/Attraction_Review-g297473-d14210709-Reviews-Museo_Mapuka-Barranquilla_Atlantico_Department.html,Atlantico,Museo Mapuka,MAPUKA es el Museo Arqueológico de los Pueblos Karib. Tiene como propósito contribuir al reconocimiento de las identidades del Caribe colombiano desde la apreciación y la activación de la memoria de los procesos culturales que se vivieron en este territorio durante los periodos prehispánico y colonial hasta la primera mitad del siglo XX a través de la colección arqueológica.,1-2 horas,
12. Iglesia de la Inmaculada Concepción,https://www.tripadvisor.co/Attraction_Review-g297473-d5999862-Reviews-Iglesia_de_la_Inmaculada_Concepcion-Barranquilla_Atlantico_Department.html,Atlantico,Iglesia de la Inmaculada Concepción,,,
13. El Solar de Mao,https://www.tripadvisor.co/Attraction_Review-g4053736-d8727553-Reviews-El_Solar_de_Mao-Galapa_Atlantico_Department.html,Atlantico,El Solar de Mao,El Solar de Mao es la primera granja Eco Campestre del Atlántico para la interacción natural y el contacto vivencial con flora y fauna. Un espacio turístico para toda la familia. A través de sus espacios animales bosques árboles tenemos la posibilidad de descubrir y aprender cientos de procesos para re conectar nuestra esencia con la naturaleza. Disfruta de un espacio al aire libre recorrido interactivo restaurante campestre interacción animal y mariposario.,Más de 3 horas,
14. Antiguo Edificio de la Aduana,https://www.tripadvisor.co/Attraction_Review-g297473-d3624532-Reviews-Antiguo_Edificio_de_la_Aduana-Barranquilla_Atlantico_Department.html,Atlantico,Antiguo Edificio de la Aduana,,,Vía 40 #36 - 135 Barranquilla 080003 Colombia
15. Malecon Leon Caridi,https://www.tripadvisor.co/Attraction_Review-g297473-d4751885-Reviews-Malecon_Leon_Caridi-Barranquilla_Atlantico_Department.html,Atlantico,Malecon Leon Caridi,,,
16. Plaza de la Paz,https://www.tripadvisor.co/Attraction_Review-g297473-d5043118-Reviews-Plaza_de_la_Paz-Barranquilla_Atlantico_Department.html,Atlantico,Plaza de la Paz,,,Calle 53 46 07 Barranquilla 423423423 Colombia
17. Parroquia de San Nicolás de Tolentino,https://www.tripadvisor.co/Attraction_Review-g297473-d4084717-Reviews-Parroquia_de_San_Nicolas_de_Tolentino-Barranquilla_Atlantico_Department.html,Atlantico,Parroquia de San Nicolás de Tolentino,,,
18. Estadio Metropolitano Roberto Melendez,https://www.tripadvisor.co/Attraction_Review-g297473-d4783135-Reviews-Estadio_Metropolitano_Roberto_Melendez-Barranquilla_Atlantico_Department.html,Atlantico,Estadio Metropolitano Roberto Melendez,,,
19. Inmueble Patrimonial Julio Flórez,https://www.tripadvisor.co/Attraction_Review-g2716332-d2695327-Reviews-Inmueble_Patrimonial_Julio_Florez-Usiacuri_Atlantico_Department.html,Atlantico,Inmueble Patrimonial Julio Flórez,Una cómoda y fresca vivienda que hoy funciona como museo y donde fueron enterrados los restos del Poeta. aún conserva los detalles arquitectónicos de la época como la frescura del techo de paja los muebles originales de aquellos tiempos y un ambiente romántico y melancólico que el Poeta le imprimió a sus cimientos.,< 1 hora,Transversal 20 No 18-40 Usiacurí 082060 Colombia
20. Centro de Convenciones Puerta de Oro,https://www.tripadvisor.co/Attraction_Review-g297473-d8599578-Reviews-Centro_de_Convenciones_Puerta_de_Oro-Barranquilla_Atlantico_Department.html,Atlantico,Centro de Convenciones Puerta de Oro,,,
21. Parque Isla Salamanca,https://www.tripadvisor.co/Attraction_Review-g297473-d3624562-Reviews-Parque_Isla_Salamanca-Barranquilla_Atlantico_Department.html,Atlantico,Parque Isla Salamanca,,,
22. El Prado,https://www.tripadvisor.co/Attraction_Review-g297473-d8858146-Reviews-El_Prado-Barranquilla_Atlantico_Department.html,Atlantico,El Prado,,,
23. Parque de Villa Santos,https://www.tripadvisor.co/Attraction_Review-g297473-d8587709-Reviews-Parque_de_Villa_Santos-Barranquilla_Atlantico_Department.html,Atlantico,Parque de Villa Santos,,,
24. Plaza San Nicolás,https://www.tripadvisor.co/Attraction_Review-g297473-d3223488-Reviews-Plaza_San_Nicolas-Barranquilla_Atlantico_Department.html,Atlantico,Plaza San Nicolás,La plaza de San Nicolás es un espacio público abierto de la ciudad colombiana de Barranquilla. Desde el siglo XVIII hasta la primera mitad del XX fue el epicentro de la vida social comercial y cultural de la ciudad. Está ubicada frente a la iglesia de San Nicolás de Tolentino en el Centro Histórico de Barranquilla del cual es uno de los baluartes de su recuperación. En julio de 2009 el Ministerio de Cultura inició su proceso de restauración y recuperación y el 16 de marzo de 2011 fue reinaugurada y puesta al servicio y disfrute de la comunidad,Sugiere ediciones para mejorar lo que mostramos.Mejorar este perfil,
25. Bojanini Art Gallery,https://www.tripadvisor.co/Attraction_Review-g297473-d2489153-Reviews-Bojanini_Art_Gallery-Barranquilla_Atlantico_Department.html,Atlantico,Bojanini Art Gallery,,,Calle 79 No. 51-35 Barranquilla 00000 Colombia
26. Megua Parque Biotemático,https://www.tripadvisor.co/Attraction_Review-g4053736-d4049623-Reviews-Megua_Parque_Biotematico-Galapa_Atlantico_Department.html,Atlantico,Megua Parque Biotemático,Es un parque natural enfocado a la educación para la conservación del ecosistema aunque tiene 8 años de funcionamiento solo hasta hace poco se esta haciendo propaganda al publico antes solo iban colegios y demas instituciones educativas. Este es uno de los pocos lugares en el Depto. del Atlántico donde se puede disfrutar de la interacción con la naturaleza al mismo tiempo que aprendemos datos únicos y curiosos de ella así como las maneras de conservarla. Aunque esta enfocado en los niños los adultos que nos gusta el ecoturismo disfrutamos bastante en el. Los guías están muy atentos a cada una de las observaciones dudas y sugerencias de los visitantes tienen muchos proyectos por terminar pero la dedicación y entrega que demuestran sus dueños de seguro les dará buenos frutos. Con relación a la comida que ofrecen lo que mas me gustó es que aunque tienen restaurante de muy buena comida a precios favorables podemos también llevar nuestro alimento mientras disfrutamos del entorno.,Incluye animalesObtén más información sobre el bienestar animal en el turismo,
27. Parque Paseo de la Castellana,https://www.tripadvisor.co/Attraction_Review-g297473-d8409987-Reviews-Parque_Paseo_de_la_Castellana-Barranquilla_Atlantico_Department.html,Atlantico,Parque Paseo de la Castellana,,,
28. Sala del carnaval Elsa Caridi,https://www.tripadvisor.co/Attraction_Review-g297473-d2695346-Reviews-Sala_del_carnaval_Elsa_Caridi-Barranquilla_Atlantico_Department.html,Atlantico,Sala del carnaval Elsa Caridi,,,
29. Centro Comercial Portal del Prado,https://www.tripadvisor.co/Attraction_Review-g297473-d7742640-Reviews-Centro_Comercial_Portal_del_Prado-Barranquilla_Atlantico_Department.html,Atlantico,Centro Comercial Portal del Prado,,,Calle 53 No. 46-192 Barranquilla 080011 Colombia
30. Plaza de la Intendencia Fluvial,https://www.tripadvisor.co/Attraction_Review-g297473-d7726823-Reviews-Plaza_de_la_Intendencia_Fluvial-Barranquilla_Atlantico_Department.html,Atlantico,Plaza de la Intendencia Fluvial,,,
31. El Malecon de Puerto Colombia,https://www.tripadvisor.co/Attraction_Review-g4454796-d8692580-Reviews-El_Malecon_de_Puerto_Colombia-Puerto_Colombia_Atlantico_Department.html,Atlantico,El Malecon de Puerto Colombia,,,
32. Iglesia Espiritu Santo,https://www.tripadvisor.co/Attraction_Review-g297473-d8052441-Reviews-Iglesia_Espiritu_Santo-Barranquilla_Atlantico_Department.html,Atlantico,Iglesia Espiritu Santo,,,
33. Iglesia de San Roque,https://www.tripadvisor.co/Attraction_Review-g297473-d7029507-Reviews-Iglesia_de_San_Roque-Barranquilla_Atlantico_Department.html,Atlantico,Iglesia de San Roque,,,
34. Centro Comercial Villa Country,https://www.tripadvisor.co/Attraction_Review-g297473-d7930989-Reviews-Centro_Comercial_Villa_Country-Barranquilla_Atlantico_Department.html,Atlantico,Centro Comercial Villa Country,,,
35. Paseo Bolívar,https://www.tripadvisor.co/Attraction_Review-g297473-d7008124-Reviews-Paseo_Bolivar-Barranquilla_Atlantico_Department.html,Atlantico,Paseo Bolívar,,,
36. Playas de Puerto Colombia,https://www.tripadvisor.co/Attraction_Review-g4454796-d4829434-Reviews-Playas_de_Puerto_Colombia-Puerto_Colombia_Atlantico_Department.html,Atlantico,Playas de Puerto Colombia,,,
37. Biblioteca Piloto del Caribe,https://www.tripadvisor.co/Attraction_Review-g297473-d6952308-Reviews-Biblioteca_Piloto_del_Caribe-Barranquilla_Atlantico_Department.html,Atlantico,Biblioteca Piloto del Caribe,,,Via 40 36 135 Barranquilla 080003 Colombia
38. Museo Romántico,https://www.tripadvisor.co/Attraction_Review-g297473-d3404873-Reviews-Museo_Romantico-Barranquilla_Atlantico_Department.html,Atlantico,Museo Romántico,,,Carrera 54 59 199 Barranquilla 080002 Colombia
39. Cementerio Universal,https://www.tripadvisor.co/Attraction_Review-g297473-d5043138-Reviews-Cementerio_Universal-Barranquilla_Atlantico_Department.html,Atlantico,Cementerio Universal,,,Calle 47 No 35-203 Barranquilla 080002 Colombia
40. Playa de Santa Verónica,https://www.tripadvisor.co/Attraction_Review-g7924399-d7920528-Reviews-Playas_de_Santa_Veronica-Juan_de_Acosta_Atlantico_Department.html,Atlantico,Playa de Santa Verónica,,,
41. Estatua del Joe Arroyo,https://www.tripadvisor.co/Attraction_Review-g297473-d11847162-Reviews-Estatua_del_Joe_Arroyo-Barranquilla_Atlantico_Department.html,Atlantico,Estatua del Joe Arroyo,,,Cra. 46 #72 Parque de los Músicos Barranquilla 081007 Colombia
42. Centro Comercial Unico,https://www.tripadvisor.co/Attraction_Review-g297473-d8803471-Reviews-Centro_Comercial_Unico-Barranquilla_Atlantico_Department.html,Atlantico,Centro Comercial Unico,,Más de 3 horas,Calle 74 38 D-113 Barranquilla 080020 Colombia
43. Parque Bosques del Norte,https://www.tripadvisor.co/Attraction_Review-g297473-d8322047-Reviews-Parque_Bosques_del_Norte-Barranquilla_Atlantico_Department.html,Atlantico,Parque Bosques del Norte,,2-3 horas,Calle 79 sur #45a- 53 Barranquilla 080014 Colombia
44. Estación Montoya,https://www.tripadvisor.co/Attraction_Review-g297473-d7007406-Reviews-Estacion_Montoya-Barranquilla_Atlantico_Department.html,Atlantico,Estación Montoya,,,
45. Centro Comercial Miramar,https://www.tripadvisor.co/Attraction_Review-g297473-d8686340-Reviews-Centro_Comercial_Miramar-Barranquilla_Atlantico_Department.html,Atlantico,Centro Comercial Miramar,,,Carrera 43 99 - 50 Barranquilla 080020 Colombia
46. Parroquia Nuestra Señora del Rosario,https://www.tripadvisor.co/Attraction_Review-g297473-d8671655-Reviews-Parroquia_Nuestra_Senora_del_Rosario-Barranquilla_Atlantico_Department.html,Atlantico,Parroquia Nuestra Señora del Rosario,,,
47. Parque Sagrado Corazón,https://www.tripadvisor.co/Attraction_Review-g297473-d7723540-Reviews-Parque_Sagrado_Corazon-Barranquilla_Atlantico_Department.html,Atlantico,Parque Sagrado Corazón,,,Carrera 42f 80 117 Barranquilla 080020 Colombia
48. Parque Washington,https://www.tripadvisor.co/Attraction_Review-g297473-d8587868-Reviews-Parque_Washington-Barranquilla_Atlantico_Department.html,Atlantico,Parque Washington,,,
49. Centro Recreacional Turipaná,https://www.tripadvisor.co/Attraction_Review-g7924360-d11965359-Reviews-Centro_Recreacional_Turipana-Tubara_Atlantico_Department.html,Atlantico,Centro Recreacional Turipaná,,,
50. Gran Plaza del Sol,https://www.tripadvisor.co/Attraction_Review-g2440181-d7930987-Reviews-Gran_Plaza_del_Sol-Soledad_Atlantico_Department.html,Atlantico,Gran Plaza del Sol,,,Carrera 32 N. 30-15 Barrio Arboleda Soledad 083001 Colombia
51. Teatro Rex,https://www.tripadvisor.co/Attraction_Review-g297473-d8692481-Reviews-Teatro_Rex-Barranquilla_Atlantico_Department.html,Atlantico,Teatro Rex,,,
52. Iglesia de las Tres Ave Marias,https://www.tripadvisor.co/Attraction_Review-g297473-d7723537-Reviews-Iglesia_de_las_Tres_Ave_Marias-Barranquilla_Atlantico_Department.html,Atlantico,Iglesia de las Tres Ave Marias,,,
53. Edificio Garcia,https://www.tripadvisor.co/Attraction_Review-g297473-d10392005-Reviews-Edificio_Garcia-Barranquilla_Atlantico_Department.html,Atlantico,Edificio Garcia,,,
54. Universidad del Atlantico,https://www.tripadvisor.co/Attraction_Review-g297473-d6951853-Reviews-Universidad_del_Atlantico-Barranquilla_Atlantico_Department.html,Atlantico,Universidad del Atlantico,,,
55. Parroquia Santa Bernardita,https://www.tripadvisor.co/Attraction_Review-g297473-d7901092-Reviews-Parroquia_Santa_Bernardita-Barranquilla_Atlantico_Department.html,Atlantico,Parroquia Santa Bernardita,,,
56. Colegio Salesiano San Roque,https://www.tripadvisor.co/Attraction_Review-g297473-d8677241-Reviews-Colegio_Salesiano_San_Roque-Barranquilla_Atlantico_Department.html,Atlantico,Colegio Salesiano San Roque,,,
57. Centro Comercial Panorama,https://www.tripadvisor.co/Attraction_Review-g297473-d7930988-Reviews-Centro_Comercial_Panorama-Barranquilla_Atlantico_Department.html,Atlantico,Centro Comercial Panorama,,,
58. Parque Aeronautico y Museo Aeronaval,https://www.tripadvisor.co/Attraction_Review-g297473-d5043137-Reviews-Parque_Aeronautico_y_Museo_Aeronaval-Barranquilla_Atlantico_Department.html,Atlantico,Parque Aeronautico y Museo Aeronaval,,,
59. Monumento La María Mulata,https://www.tripadvisor.co/Attraction_Review-g297473-d8817514-Reviews-Monumento_La_Maria_Mulata-Barranquilla_Atlantico_Department.html,Atlantico,Monumento La María Mulata,,,Calle 79 & Carrera 51 Barranquilla 080013 Colombia
60. Iglesia de Santo Domingo de Guzman,https://www.tripadvisor.co/Attraction_Review-g2716332-d7688247-Reviews-Iglesia_de_Santo_Domingo_de_Guzman-Usiacuri_Atlantico_Department.html,Atlantico,Iglesia de Santo Domingo de Guzman,,,
61. Iglesia del Sagrado Corazon,https://www.tripadvisor.co/Attraction_Review-g297473-d7901091-Reviews-Iglesia_del_Sagrado_Corazon-Barranquilla_Atlantico_Department.html,Atlantico,Iglesia del Sagrado Corazon,,,
62. Transmetro,https://www.tripadvisor.co/Attraction_Review-g297473-d8729830-Reviews-Transmetro-Barranquilla_Atlantico_Department.html,Atlantico,Transmetro,,,
63. Chorro De San Luis,https://www.tripadvisor.co/Attraction_Review-g7924360-d19318750-Reviews-Chorro_De_San_Luis-Tubara_Atlantico_Department.html,Atlantico,Chorro De San Luis,,,
64. Museo de Arte Moderno de Barranquilla,https://www.tripadvisor.co/Attraction_Review-g297473-d3619290-Reviews-Museo_de_Arte_Moderno_de_Barranquilla-Barranquilla_Atlantico_Department.html,Atlantico,Museo de Arte Moderno de Barranquilla,,,Calle 56 # 74-22 Barranquilla 080011 Colombia
65. Plaza Principal de Puerto Colombia,https://www.tripadvisor.co/Attraction_Review-g4454796-d7788435-Reviews-Plaza_Principal_de_Puerto_Colombia-Puerto_Colombia_Atlantico_Department.html,Atlantico,Plaza Principal de Puerto Colombia,,,
66. Iglesia de Nuestra Señora de Chiquinquira,https://www.tripadvisor.co/Attraction_Review-g297473-d8646487-Reviews-Iglesia_de_Nuestra_Senora_de_Chiquinquira-Barranquilla_Atlantico_Department.html,Atlantico,Iglesia de Nuestra Señora de Chiquinquira,,,
67. Jardín Botánico de Barranquilla,https://www.tripadvisor.co/Attraction_Review-g297473-d10208468-Reviews-Jardin_Botanico_de_Barranquilla-Barranquilla_Atlantico_Department.html,Atlantico,Jardín Botánico de Barranquilla,,,
68. Plaza de los Artesanos,https://www.tripadvisor.co/Attraction_Review-g297473-d9850684-Reviews-Plaza_de_los_Artesanos-Barranquilla_Atlantico_Department.html,Atlantico,Plaza de los Artesanos,,,Carrera 46 Barranquilla 081007 Colombia
69. Teatro Jose Consuegra Higgins,https://www.tripadvisor.co/Attraction_Review-g297473-d7728977-Reviews-Teatro_Jose_Consuegra_Higgins-Barranquilla_Atlantico_Department.html,Atlantico,Teatro Jose Consuegra Higgins,,,Calle 58 54-59 Barrio Viejo Prado Barranquilla 080002 Colombia
70. Santuario Mariano Nuestra Señora del Carmen de Puerto Colombia,https://www.tripadvisor.co/Attraction_Review-g4454796-d8677667-Reviews-Santuario_Mariano_Nuestra_Senora_del_Carmen_de_Puerto_Colombia-Puerto_Colombia_A.html,Atlantico,Santuario Mariano Nuestra Señora del Carmen de Puerto Colombia,,,
71. Parque de Las Nieves,https://www.tripadvisor.co/Attraction_Review-g297473-d8587899-Reviews-Parque_de_Las_Nieves-Barranquilla_Atlantico_Department.html,Atlantico,Parque de Las Nieves,,,
72. Parque Tomás Suri Salcedo,https://www.tripadvisor.co/Attraction_Review-g297473-d6922702-Reviews-Parque_Tomas_Suri_Salcedo-Barranquilla_Atlantico_Department.html,Atlantico,Parque Tomás Suri Salcedo,,,
73. Museo del Carnaval,https://www.tripadvisor.co/Attraction_Review-g297473-d23473108-Reviews-Museo_del_Carnaval-Barranquilla_Atlantico_Department.html,Atlantico,Museo del Carnaval,,,
74. Sinagoga Shaare Sedek,https://www.tripadvisor.co/Attraction_Review-g297473-d7909826-Reviews-Sinagoga_Shaare_Sedek-Barranquilla_Atlantico_Department.html,Atlantico,Sinagoga Shaare Sedek,,,
75. Iglesia San Antonio de Padua,https://www.tripadvisor.co/Attraction_Review-g2440200-d8007661-Reviews-Iglesia_San_Antonio_de_Padua-Sabanalarga_Atlantico_Department.html,Atlantico,Iglesia San Antonio de Padua,,,
76. Centro Comercial Carnaval,https://www.tripadvisor.co/Attraction_Review-g2440181-d15557351-Reviews-Centro_Comercial_Carnaval-Soledad_Atlantico_Department.html,Atlantico,Centro Comercial Carnaval,,,
77. Puerto Velero,https://www.tripadvisor.co/Attraction_Review-g7924360-d17464757-Reviews-Puerto_Velero-Tubara_Atlantico_Department.html,Atlantico,Puerto Velero,,Más de 3 horas,Km 88 vía al mar dirección Barranquilla - Cartagena Playas de Puerto Velero Tubará 081028 Colombia
78. Reserva Natural Y Ecoturistica El Horeb,https://www.tripadvisor.co/Attraction_Review-g4454796-d13129992-Reviews-Reserva_Natural_Y_Ecoturistica_El_Horeb-Puerto_Colombia_Atlantico_Department.html,Atlantico,Reserva Natural Y Ecoturistica El Horeb,,Incluye animalesObtén más información sobre el bienestar animal en el turismo,
79. Parque Cementerio Universal,https://www.tripadvisor.co/Attraction_Review-g297473-d8809628-Reviews-Parque_Cementerio_Universal-Barranquilla_Atlantico_Department.html,Atlantico,Parque Cementerio Universal,,,
80. Estación del Antiguo Ferrocarril de Bolivar,https://www.tripadvisor.co/Attraction_Review-g4454796-d8677666-Reviews-Estacion_del_Antiguo_Ferrocarril_de_Bolivar-Puerto_Colombia_Atlantico_Department.html,Atlantico,Estación del Antiguo Ferrocarril de Bolivar,,,
81. Cauca Viejo,https://www.tripadvisor.co/Attraction_Review-g4454796-d9731581-Reviews-Cauca_Viejo-Puerto_Colombia_Atlantico_Department.html,Atlantico,Cauca Viejo,,Más de 3 horas,
82. Parque Jose Prudencio Padilla,https://www.tripadvisor.co/Attraction_Review-g297473-d7007449-Reviews-Parque_Jose_Prudencio_Padilla-Barranquilla_Atlantico_Department.html,Atlantico,Parque Jose Prudencio Padilla,,,Calle 98 Barranquilla 34234234234 Colombia
83. Centro Comercial Gran Boulevard,https://www.tripadvisor.co/Attraction_Review-g297473-d8423085-Reviews-Centro_Comercial_Gran_Boulevard-Barranquilla_Atlantico_Department.html,Atlantico,Centro Comercial Gran Boulevard,,,
84. Gran Casino Buenavista,https://www.tripadvisor.co/Attraction_Review-g297473-d9737798-Reviews-Gran_Casino_Buenavista-Barranquilla_Atlantico_Department.html,Atlantico,Gran Casino Buenavista,Gran Casino Buenavista es el sitio de entretenimiento al norte de Barranquilla. Disfruta de un divertido parque de máquinas juego vivo cafe-bar y toda la emoción del juego en este exclusivo lugar.,Más de 3 horas,
85. Parque Venezuela Magico,https://www.tripadvisor.co/Attraction_Review-g297473-d6951851-Reviews-Parque_Venezuela_Magico-Barranquilla_Atlantico_Department.html,Atlantico,Parque Venezuela Magico,,,
86. Centro Islámico Mezquita Othman Ben Affan,https://www.tripadvisor.co/Attraction_Review-g297473-d7967122-Reviews-Centro_Islamico_Mezquita_Othman_Ben_Affan-Barranquilla_Atlantico_Department.html,Atlantico,Centro Islámico Mezquita Othman Ben Affan,,,
87. Bellas Artes,https://www.tripadvisor.co/Attraction_Review-g297473-d8738857-Reviews-Bellas_Artes-Barranquilla_Atlantico_Department.html,Atlantico,Bellas Artes,,,
88. La Troja,https://www.tripadvisor.co/Attraction_Review-g297473-d3236398-Reviews-La_Troja-Barranquilla_Atlantico_Department.html,Atlantico,La Troja,La Troja con 50 años de tradición fue declarado por el Instituto Distrital de Cultura como Patrimonio Cultural y Musical de la Ciudad de Barranquilla. Un espacio de recreación cultura y música donde la salsa es el eje central presentada en CD y acetato. En este lugar se le hace un gran homenaje a los Pickup que durante muchos años le han regalado al bailador barranquillero y caribeño el sonido de los temas del momento. Definitivamente este lugar es un espacio maravilloso para disfrutar en buena compañía de la magia que nos regala el caribe. Felicitaciones a Edwin Madera y a todo su equipo por esta iniciativa. Patrimonio Cultural y Musical de la Ciudad de Barranquilla.,Más de 3 horas,Calle 74 Cra 44 Esquina Barranquilla 080016 Colombia
89. Museo del Atlantico,https://www.tripadvisor.co/Attraction_Review-g297473-d8809634-Reviews-Museo_del_Atlantico-Barranquilla_Atlantico_Department.html,Atlantico,Museo del Atlantico,,,Calle 35 38 - 85 Barranquilla 080003 Colombia
